{
  "bundle_path": "/Volumes/T7 Touch/mini/rather-not-work-on/platform-planningops/planningops/artifacts/validation/federated-ci-20260326T055945Z-summary-tmp-reconcile-bundle.json",
  "validation_report_path": "/Volumes/T7 Touch/mini/rather-not-work-on/platform-planningops/planningops/artifacts/validation/federated-ci-20260326T055945Z-summary-tmp-reconcile-bundle-validation.json",
  "bundle_present": true,
  "validation_present": true,
  "artifact_file": "/Volumes/T7 Touch/mini/rather-not-work-on/platform-planningops/planningops/artifacts/validation/federated-ci-20260326T055945Z-summary-tmp-reconcile.json",
  "reconcile_report_path": "/Volumes/T7 Touch/mini/rather-not-work-on/platform-planningops/planningops/artifacts/validation/federated-ci-20260326T055945Z-summary-tmp-reconcile.json",
  "reconcile_validation_report_path": "/Volumes/T7 Touch/mini/rather-not-work-on/platform-planningops/planningops/artifacts/validation/federated-ci-20260326T055945Z-summary-tmp-reconcile-validation.json",
  "run_id": "federated-ci-20260326T055945Z",
  "reconcile_status": "healthy",
  "check_name": "loop-guardrails-outer-status-bundle-validation",
  "reconcile_count": 0,
  "reconcile_validation_verdict": "pass",
  "bundle_validation_verdict": "pass",
  "bundle_validation_state": "fresh",
  "ready": true,
  "next_step": "none",
  "generated_at_utc": "2026-03-26T06:03:21.241505+00:00",
  "output_path": "/Volumes/T7 Touch/mini/rather-not-work-on/platform-planningops/planningops/artifacts/validation/federated-ci-20260326T055945Z-summary-tmp-reconcile-bundle-status.json",
  "status_validation_output_path": "/Volumes/T7 Touch/mini/rather-not-work-on/platform-planningops/planningops/artifacts/validation/federated-ci-20260326T055945Z-summary-tmp-reconcile-bundle-status-validation.json"
}
